{"activated_at":"2026-07-19T23:00:00.000Z","activation_reason":"founder-bootstrap","active_installation_id":"ins_eeeeeeee-eeee-4eee-8eee-eeeeeeeeeeee","connection_registry":{"path":"registries/connection-registry.reg_22222222-2222-4222-8222-222222222222.r1.v1.json","registry_id":"reg_22222222-2222-4222-8222-222222222222","revision":1,"sha256":"sha256:8caff31e88aa29d5259948558a47ad9e395c2e0d04975c985aed8b17a217e7ed"},"default_publication_policy":{"path":"policies/publication-policy.pol_33333333-3333-4333-8333-333333333333.v1.json","policy_id":"pol_33333333-3333-4333-8333-333333333333","sha256":"sha256:2bbbc88241ce3cf83e6215ebcc7bc270e2ff201bce4230d165fc85a979851b01","version":1},"integrity":{"canonicalization":"RFC8785","key_id":"sha256:bfd16b896c8320ae199b684cdb03c6bb39d062442e4352fd4a2275ae1d826c70","payload_sha256":"sha256:2f9bf17491bb26ea4df99762c0d305291690fb7bfd1f12e8ee5600bb8754f44f","signature_algorithm":"ecdsa-p256-sha256-der-low-s","signature_base64":"MEUCIQC+kM7ynxMCwtS4hsxELAPz2Nl2NE2kvbdHUXhYlSTsawIgOSwnj+72+genAuEjKlhO8jzcI/WOOt/jWe5TFRylyMY="},"kind":"echo-active-identity-bundle","manifest":{"manifest_id":"idm_11111111-1111-4111-8111-111111111111","path":"manifests/identity-manifest.idm_11111111-1111-4111-8111-111111111111.v1.json","sha256":"sha256:e06a970de9c8cf8d3ea2f76a1d7aab185254188f208d8c47c0bb4c118d11c16e"},"schema_version":1}